{
 "$schema": "https://json-schema.org/draft/2020-12/schema",
 "title": "Vulnerability record",
 "description": "macguard.intel-vulnerability/1. One vulnerability as served by the portal/API (INTEL migrations 0004+0005). Missing data is null or an empty list, never zero. Aliases are only source-asserted equivalences (disputed ones are listed apart and never merged). There is no 'not exploited' value: exploitation.evidence_status says whether evidence is recorded, and kev.status NOT_LISTED is always 'as of' a snapshot. EPSS is a probability of exploitation activity in the next 30 days, not a severity. Additive changes keep the number, any other change takes a new one.",
 "type": "object",
 "additionalProperties": false,
 "required": ["schema", "id", "namespace", "aliases", "disputed_aliases", "weaknesses", "severity", "epss", "exploitation", "affected", "advisories", "detections", "indicators", "poc_references"],
 "properties": {
  "schema": { "const": "macguard.intel-vulnerability/1" },
  "id": { "type": "string", "pattern": "^(CVE-[0-9]{4}-[0-9]{4,}|EUVD-[0-9]{4}-[0-9]+|GCVE-[0-9]{1,10}-[0-9]{4}-[0-9]+|GHSA(-[23456789cfghjmpqrvwx]{4}){3})$" },
  "namespace": { "enum": ["cve", "euvd", "gcve", "ghsa"] },
  "title": { "type": ["string", "null"], "maxLength": 500 },
  "summary": { "type": ["string", "null"], "maxLength": 4000 },
  "published": { "type": ["string", "null"], "maxLength": 40 },
  "modified": { "type": ["string", "null"], "maxLength": 40 },
  "aliases": { "type": "array", "maxItems": 200, "items": { "type": "object", "additionalProperties": false, "required": ["id", "namespace", "source", "confidence"], "properties": {
   "id": { "type": "string", "maxLength": 64 }, "namespace": { "enum": ["cve", "euvd", "gcve", "ghsa"] }, "source": { "type": "string", "maxLength": 128 }, "observed_at": { "type": ["string", "null"], "maxLength": 40 },
   "confidence": { "enum": ["CONFIRMED", "REPORTED"] } } } },
  "disputed_aliases": { "type": "array", "maxItems": 200, "items": { "type": "object", "additionalProperties": false, "required": ["id", "namespace", "source", "confidence"], "properties": {
   "id": { "type": "string", "maxLength": 64 }, "namespace": { "enum": ["cve", "euvd", "gcve", "ghsa"] }, "source": { "type": "string", "maxLength": 128 }, "observed_at": { "type": ["string", "null"], "maxLength": 40 },
   "confidence": { "enum": ["INFERRED", "DISPUTED", "UNKNOWN"] } } } },
  "weaknesses": { "type": "array", "maxItems": 200, "items": { "type": "object", "additionalProperties": false, "required": ["cwe", "source", "confidence"], "properties": {
   "cwe": { "type": "string", "pattern": "^CWE-[0-9]{1,6}$" }, "source": { "type": "string", "maxLength": 128 }, "confidence": { "enum": ["CONFIRMED", "REPORTED", "INFERRED", "DISPUTED", "UNKNOWN"] } } } },
  "severity": { "type": "array", "maxItems": 200, "items": { "type": "object", "additionalProperties": false, "required": ["source", "cvss_version", "availability", "vector", "base_score", "severity", "assessed_at"], "properties": {
   "source": { "type": "string", "maxLength": 128 }, "cvss_version": { "enum": ["2.0", "3.0", "3.1", "4.0"] }, "availability": { "enum": ["AVAILABLE", "NOT_PROVIDED", "WITHDRAWN"] },
   "vector": { "type": ["string", "null"], "maxLength": 300 }, "base_score": { "type": ["number", "null"] }, "severity": { "enum": ["NONE", "LOW", "MEDIUM", "HIGH", "CRITICAL", null] }, "assessed_at": { "type": "string", "maxLength": 40 } } } },
  "epss": { "oneOf": [ { "type": "null" }, { "type": "object", "additionalProperties": false, "required": ["source", "score_date", "probability", "percentile", "meaning"], "properties": {
   "source": { "type": "string", "maxLength": 128 }, "score_date": { "type": "string", "pattern": "^[0-9]{4}-[0-9]{2}-[0-9]{2}$" }, "probability": { "type": "number" }, "percentile": { "type": "number" },
   "model_version": { "type": ["string", "null"], "maxLength": 64 }, "meaning": { "type": "string", "maxLength": 200 } } } ] },
  "exploitation": { "type": "object", "additionalProperties": false, "required": ["kev", "evidence_status", "evidence"], "properties": {
   "kev": { "type": "object", "additionalProperties": false, "required": ["status", "source", "as_of"], "properties": {
    "status": { "enum": ["LISTED", "NOT_LISTED", "UNKNOWN"] }, "source": { "type": "string", "maxLength": 128 }, "as_of": { "type": ["string", "null"], "maxLength": 40 },
    "date_added": { "type": ["string", "null"], "maxLength": 10 }, "due_date": { "type": ["string", "null"], "maxLength": 10 }, "required_action": { "type": ["string", "null"], "maxLength": 2000 }, "note": { "type": "string", "maxLength": 200 } } },
   "evidence_status": { "enum": ["EVIDENCE_RECORDED", "NO_EVIDENCE_RECORDED"] },
   "evidence": { "type": "array", "maxItems": 200, "items": { "type": "object", "additionalProperties": false, "required": ["source", "kind", "observed_at", "ref"], "properties": {
    "source": { "type": "string", "maxLength": 128 }, "kind": { "enum": ["KEV_LISTED", "EXPLOITED_IN_THE_WILD_REPORTED", "VENDOR_CONFIRMED_EXPLOITATION"] }, "observed_at": { "type": "string", "maxLength": 40 }, "ref": { "type": "string", "maxLength": 1024 } } } } } },
  "affected": { "type": "array", "maxItems": 200, "items": { "type": "object", "additionalProperties": false, "required": ["product", "scheme", "source", "confidence"], "properties": {
   "product": { "type": "object", "additionalProperties": false, "required": ["namespace", "key"], "properties": { "namespace": { "enum": ["cpe", "purl"] }, "key": { "type": "string", "maxLength": 512 } } },
   "scheme": { "enum": ["SEMVER", "ECOSYSTEM", "CPE", "GIT"] }, "ecosystem": { "type": ["string", "null"], "maxLength": 64 }, "introduced": { "type": ["string", "null"], "maxLength": 128 },
   "fixed": { "type": ["string", "null"], "maxLength": 128 }, "last_affected": { "type": ["string", "null"], "maxLength": 128 }, "version_limit": { "type": ["string", "null"], "maxLength": 128 }, "source": { "type": "string", "maxLength": 128 },
   "confidence": { "enum": ["CONFIRMED", "REPORTED", "INFERRED", "DISPUTED", "UNKNOWN"] } } } },
  "advisories": { "type": "array", "maxItems": 200, "items": { "type": "object", "additionalProperties": false, "required": ["id", "source", "confidence"], "properties": {
   "id": { "type": "string", "maxLength": 512 }, "source": { "type": "string", "maxLength": 128 }, "confidence": { "enum": ["CONFIRMED", "REPORTED", "INFERRED", "DISPUTED", "UNKNOWN"] } } } },
  "detections": { "type": "array", "maxItems": 200, "description": "Premium (intel.correlation.read). level: related | compatible | detects-behaviour | claimed-detection | validated-detection (only CONFIRMED+VERIFIED with a test run). An empty list means no verified rule is available, not that none exists under restriction: the API says so separately.", "items": { "type": "object", "additionalProperties": false, "required": ["rule", "family", "level", "confidence", "verification"], "properties": {
   "rule": { "type": "string", "maxLength": 512 }, "family": { "type": "string", "maxLength": 64 }, "level": { "enum": ["related", "compatible", "detects-behaviour", "claimed-detection", "validated-detection"] },
   "confidence": { "enum": ["CONFIRMED", "REPORTED", "INFERRED", "DISPUTED", "UNKNOWN"] }, "verification": { "enum": ["VERIFIED", "UNVERIFIED", "FAILED"] } } } },
  "indicators": { "type": "array", "maxItems": 200, "description": "Premium (ioc.premium.read).", "items": { "type": "object", "additionalProperties": false, "required": ["type", "value", "source", "confidence"], "properties": {
   "type": { "type": "string", "maxLength": 64 }, "value": { "type": "string", "maxLength": 512 }, "source": { "type": "string", "maxLength": 128 }, "confidence": { "enum": ["CONFIRMED", "REPORTED", "INFERRED", "DISPUTED", "UNKNOWN"] } } } },
  "poc_references": { "type": "array", "maxItems": 200, "description": "Metadata only (research.poc.metadata.read). Never executable content, never in a defensive package.", "items": { "type": "object", "additionalProperties": false, "required": ["ref", "source", "confidence", "review", "executable_content"], "properties": {
   "ref": { "type": "string", "maxLength": 1024 }, "source": { "type": "string", "maxLength": 128 }, "confidence": { "enum": ["CONFIRMED", "REPORTED", "INFERRED", "DISPUTED", "UNKNOWN"] },
   "review": { "enum": ["HUMAN_REVIEWED", "NOT_REVIEWED"] }, "executable_content": { "const": false } } } }
 }
}
